start_page,end_page,start_word,end_word,tag,extracted_text
142,145,report of independent registered public accounting firm to the shareholders and the board of directors of the bank of nova scotia,consolidated statement of financial position as at october 31,consolidated_finnacial_statement,"report of independent registered public accounting firm to the shareholders and the board of directors of the bank of nova scotia opinion on the consolidated financial statements we have audited the accompanying consolidated statements of financial position of the bank of nova scotia (the bank) as of october 31, 2024 and 2023, the related consolidated statements of income, comprehensive income, changes in equity and cash flows for the years then ended, and the related notes (collectively, the consolidated financial statements). in our opinion, the consolidated financial statements present fairly, in all material respects, the financial position of the bank as of october 31, 2024 and 2023, and its financial performance and its cash flows for the years then ended, in conformity with international financial reporting standards (ifrs) as issued by the international accounting standards board (iasb). we also have audited, in accordance with the standards of the public company accounting oversight board (united states) (pcaob), the bank’s internal control over financial reporting as of october 31, 2024, based on criteria established in internal control – integrated framework (2013) issued by the committee of sponsoring organizations of the treadway commission, and our report dated december 3, 2024 expressed an unqualified opinion on the effectiveness of the bank’s internal control over financial reporting. basis for opinion these consolidated financial statements are the responsibility of the bank’s management. our responsibility is to express an opinion on these consolidated financial statements based on our audits. we are a public accounting firm registered with the pcaob and are required to be independent with respect to the bank in accordance with the u.s. federal securities laws and the applicable rules and regulations of the securities and exchange commission and the pcaob. we conducted our audits in accordance with the standards of the pcaob. those standards require that we plan and perform the audit to obtain reasonable assurance about whether the consolidated financial statements are free of material misstatement, whether due to error or fraud. our audits included performing procedures to assess the risks of material misstatement of the consolidated financial statements, whether due to error or fraud, and performing procedures that respond to those risks. such procedures included examining, on a test basis, evidence regarding the amounts and disclosures in the consolidated financial statements. our audits also included evaluating the accounting principles used and significant estimates made by management, as well as evaluating the overall presentation of the consolidated financial statements. we believe that our audits provide a reasonable basis for our opinion. critical audit matters the critical audit matters communicated below are matters arising from the current period audit of the consolidated financial statements that were communicated or required to be communicated to the audit and conduct review committee and that: (1) relate to accounts or disclosures that are material to the consolidated financial statements and (2) involved our especially challenging, subjective, or complex judgments. the communication of critical audit matters does not alter in any way our opinion on the consolidated financial statements, taken as a whole, and we are not, by communicating the critical audit matters below, providing separate opinions on the critical audit matters or on the accounts or disclosures to which they relate. (i) assessment of allowance for credit losses (acl) refer to notes 3 and 14 to the consolidated financial statements. the bank’s acl on loans was $6,536 million as at october 31, 2024. the bank applies a three-stage approach to measure the acl, using an expected credit loss (ecl) approach as required under ifrs 9 financial instruments. the bank’s acl calculations are outputs of a set of complex models. the acl calculations reflect probability-weighted outcomes that consider multiple scenarios based on reasonable and supportable forecasts. the probability of default (pd), loss given default (lgd) and exposure at default (ead) inputs used to estimate ecl are modeled based on historical default and loss experience, and macroeconomic variables that are closely related with credit losses in the relevant portfolio. the bank assesses whether there has been a significant increase in credit risk since origination or where the financial asset is in default. if there has been a significant increase in credit risk or the financial asset is in default, then lifetime acl is recorded; otherwise, an acl equal to 12 month expected credit losses is recorded. the estimation of ecl for each stage and the assessment of significant increases in credit risk consider information about past events and current conditions as well as forecasts of future events and economic conditions. the estimation and application of forward- looking information requires significant judgment. qualitative adjustments or overlays may also be recorded as temporary adjustments using expert credit judgment where the inputs, assumptions and/or models do not capture all relevant risk factors. the use of management overlays requires significant judgment that may impact the amount of acl recognized. we identified the assessment of the acl as a critical audit matter. significant auditor judgment was required because there was a high degree of measurement uncertainty due to the significant management judgments inherent in certain of the bank’s key modeled inputs and methodologies. these management judgments impact certain inputs, assumptions, qualitative adjustments or overlays, and the determination of when there has been a significant increase in credit risk. the assessment of the acl also required significant auditor attention and complex auditor judgment to apply and evaluate the results of audit procedures. further, specialized skills and knowledge, including experience in the industry, were required to apply audit procedures and evaluate the results of those procedures. the following are the primary procedures we performed to address this critical audit matter. with the involvement of our credit risk and economics professionals with specialized skills, industry knowledge and relevant experience, we evaluated the design and tested the operating effectiveness of certain internal controls related to the bank’s acl process. these included internal controls related to: (1) initial and periodic validation and performance monitoring of models used to derive key modeled inputs into the acl calculation being pd, lgd and ead; (2) benchmarking of certain macroeconomic variables, model validation associated with the derivation of the remaining variables and the alternative scenarios and review of probability weights used in the acl models; (3) the methodology used to determine whether there has been a significant increase in credit risk; and (4) the methodology and assumptions used in the determination of qualitative adjustments or overlays. additionally, for non-retail loans, we tested certain internal controls related to loan reviews over the determination of loan risk grades. we involved credit risk and economics professionals with specialized skills, industry knowledge and relevant experience who assisted in: (1) evaluating the methodology and models used to derive key modeled inputs into the acl calculation being pd, lgd and ead and the determination of whether there has been a significant increase in credit risk; (2) assessing the appropriateness of certain underlying macroeconomic variables against external economic data, evaluating the models used to derive other macroeconomic variables and evaluating the assumptions associated with the alternative economic scenarios and 140 | 2024 scotiabank annual report
the related probabilities; and (3) assessing the qualitative adjustments or overlays by applying our knowledge of the industry and credit judgment to evaluate the appropriateness of the bank’s underlying methodology and assumptions. additionally, for a selection of non-retail loans, we evaluated the bank’s assigned loan risk grades against the bank’s borrower risk rating methodology. (ii) assessment of the measurement of fair value of certain financial instruments refer to notes 3 and 8 to the consolidated financial statements. the bank measures certain financial assets and financial liabilities at fair value on a recurring basis. where such financial instruments trade in inactive markets or when using internal models where observable parameters do not exist, significant management judgment is required in the selection of valuation techniques and model inputs. the valuation techniques used in determining the fair value of financial instruments include internal models and net asset valuations. the significant unobservable inputs used in the bank’s valuation techniques include general partner valuations per net asset values (navs), interest rate volatility, equity volatility and equity correlation. we identified the assessment of the measurement of fair value for certain financial instruments as a critical audit matter. significant auditor judgment was required because there was a high degree of measurement uncertainty due to significant judgments inherent in the bank’s valuation techniques and significant unobservable inputs used to develop the fair value of certain financial assets and financial liabilities. the assessment of the fair value also required significant auditor attention and complex auditor judgment to apply and evaluate the results of audit procedures. further, specialized skills and knowledge, including experience in the industry, were required to apply audit procedures and evaluate the results of those procedures. the following are the primary procedures we performed to address this critical audit matter. we evaluated the design and tested the operating effectiveness of certain internal controls related to the bank’s processes to determine the fair value of certain financial instruments with the involvement of valuation and information technology professionals with specialized skills, industry knowledge and relevant experience. these included internal controls related to: (1) model validation at inception and periodically; (2) management’s review of navs; (3) independent price verification, including assessment of rate sources; and (4) segregation of duties and access controls. with the involvement of valuation professionals with specialized skills, industry knowledge and relevant experience, we tested the fair value of a selection of certain financial instruments. depending on the nature of the financial instruments, we did this by comparing the navs to external information or by developing an independent estimate of fair value and comparing it to the fair value determined by the bank. (iii) assessment of uncertain tax provisions refer to notes 3 and 28 to the consolidated financial statements. the bank maintains provisions for uncertain tax positions that it believes appropriately reflect the risk of tax positions under discussion, audit, dispute, or appeal with tax authorities, or which are otherwise considered to involve uncertainty. these provisions are made using the bank’s best estimate of the amount expected to be paid based on an assessment of all relevant factors, which are reviewed at the end of each reporting period. we identified the assessment of some uncertain tax provisions as a critical audit matter. significant auditor judgment was required because there was a high degree of measurement uncertainty due to the significant judgments inherent in the bank’s interpretation of tax legislation and its best estimate of the ultimate resolution of tax positions. this required significant auditor attention and complex auditor judgment to evaluate the results of audit procedures. further, specialized skills, industry knowledge, and relevant experience were required to apply audit procedures and evaluate the results of those procedures. the following are the primary procedures we performed to address this critical audit matter. we evaluated the design and tested the operating effectiveness of certain internal controls related to the bank’s income tax uncertainties process with the involvement of taxation professionals with specialized skills, industry knowledge and relevant experience. these included internal controls related to: (1) the interpretation of tax legislation and the evaluation of the technical merits of tax positions; and (2) the determination of the best estimate of the provision required for these tax uncertainties. we involved tax professionals with specialized skills and knowledge, who assisted in: (1) evaluating the bank’s interpretations of tax legislation based on our knowledge and experience; (2) reading and evaluating advice obtained by the bank from external counsel, and considering its impact on the measurement, if applicable, of the uncertain tax provisions; and (3) inspecting correspondence with applicable taxation authorities. chartered professional accountants, licensed public accountants we have served as the bank’s auditor since 2006 and as joint auditor for 14 years prior to that. toronto, canada december 3, 2024 consolidated financial statements 2024 scotiabank annual report | 141
consolidated financial statements report of independent registered public accounting firm to the shareholders and the board of directors of the bank of nova scotia opinion on internal control over financial reporting we have audited the bank of nova scotia’s internal control over financial reporting as of october 31, 2024, based on the criteria established in internal control – integrated framework (2013) issued by the committee of sponsoring organizations of the treadway commission. in our opinion, the bank of nova scotia (the bank) maintained, in all material respects, effective internal control over financial reporting as of october 31, 2024, based on the criteria established in internal control – integrated framework (2013) issued by the committee of sponsoring organizations of the treadway commission. we also have audited, in accordance with the standards of the public company accounting oversight board (united states) (pcaob), the consolidated statements of financial position of the bank as of october 31, 2024, and 2023, the related consolidated statements of income, comprehensive income, changes in equity and cash flows for the years then ended, and the related notes (collectively, the consolidated financial statements) and our report dated december 3, 2024 expressed an unqualified opinion on those consolidated financial statements. basis for opinion the bank’s management is responsible for maintaining effective internal control over financial reporting and for its assessment of the effectiveness of internal control over financial reporting, included in the controls and accounting policies section of management’s discussion and analysis under the heading “internal control over financial reporting”. our responsibility is to express an opinion on the bank’s internal control over financial reporting based on our audit. we are a public accounting firm registered with the pcaob and are required to be independent with respect to the bank in accordance with the u.s. federal securities laws and the applicable rules and regulations of the securities and exchange commission and the pcaob. we conducted our audit in accordance with the standards of the pcaob. those standards require that we plan and perform the audit to obtain reasonable assurance about whether effective internal control over financial reporting was maintained in all material respects. our audit of internal control over financial reporting included obtaining an understanding of internal control over financial reporting, assessing the risk that a material weakness exists, and testing and evaluating the design and operating effectiveness of internal control based on the assessed risk. our audit also included performing such other procedures as we considered necessary in the circumstances. we believe that our audit provides a reasonable basis for our opinion. definition and limitations of internal control over financial reporting a company’s internal control over financial reporting is a process designed to provide reasonable assurance regarding the reliability of financial reporting and the preparation of financial statements for external purposes in accordance with generally accepted accounting principles. a company’s internal control over financial reporting includes those policies and procedures that (1) pertain to the maintenance of records that, in reasonable detail, accurately and fairly reflect the transactions and dispositions of the assets of the company; (2) provide reasonable assurance that transactions are recorded as necessary to permit preparation of financial statements in accordance with generally accepted accounting principles, and that receipts and expenditures of the company are being made only in accordance with authorizations of management and directors of the company; and (3) provide reasonable assurance regarding prevention or timely detection of unauthorized acquisition, use, or disposition of the company’s assets that could have a material effect on the financial statements. because of its inherent limitations, internal control over financial reporting may not prevent or detect misstatements. also, projections of any evaluation of effectiveness to future periods are subject to the risk that controls may become inadequate because of changes in conditions, or that the degree of compliance with the policies or procedures may deteriorate. chartered professional accountants, licensed public accountants toronto, canada december 3, 2024 142 | 2024 scotiabank annual report"
138,139,consolidated financial statements management’s responsibility for financial information,independent auditor’s report to the shareholders and the board of directors of the bank of nova scotia,notes_consolidated_finnacial_statement,"consolidated financial statements management’s responsibility for financial information the management of the bank of nova scotia (the bank) is responsible for the integrity and fair presentation of the financial information contained in this annual report. the consolidated financial statements have been prepared in accordance with international financial reporting standards (ifrs) as issued by the international accounting standards board (iasb). the consolidated financial statements also comply with the accounting requirements of the bank act. the consolidated financial statements, where necessary, include amounts which are based on the best estimates and judgment of management. financial information presented elsewhere in this annual report is consistent with that shown in the consolidated financial statements. management has always recognized the importance of the bank maintaining and reinforcing the highest possible standards of conduct in all of its actions, including the preparation and dissemination of statements fairly presenting the financial condition of the bank. in this regard, management has developed and maintains a system of accounting and reporting which provides for the necessary internal controls to ensure that transactions are properly authorized and recorded, assets are safeguarded against unauthorized use or disposition, and liabilities are recognized. the system is augmented by written policies and procedures, the careful selection and training of qualified staff, the establishment of organizational structures providing an appropriate and well-defined division of responsibilities, and the communication of policies and guidelines of scotiabank’s code of conduct throughout the bank. management, under the supervision of and the participation of the president and chief executive officer and the group head and chief financial officer, have a process in place to evaluate disclosure controls and procedures and internal control over financial reporting in line with canadian and u.s. securities regulations. the system of internal controls is further supported by a professional staff of internal auditors who conduct periodic audits of all aspects of the bank’s operations. as well, the bank’s chief auditor has full and free access to, and meets periodically with the audit and conduct review committee of the board of directors. in addition, the bank’s compliance function maintains policies, procedures and programs directed at ensuring compliance with regulatory requirements, including conflict of interest rules. the office of the superintendent of financial institutions canada, which is mandated to protect the rights and interests of the depositors and creditors of the bank, examines and enquires into the business and affairs of the bank, as deemed necessary, to determine whether the provisions of the bank act are being complied with, and that the bank is in a sound financial condition. the audit and conduct review committee, composed entirely of outside directors, reviews the consolidated financial statements with both management and the independent auditors before such statements are approved by the board of directors and submitted to the shareholders of the bank. the audit and conduct review committee reviews and reports its findings to the board of directors on all related party transactions that may have a material impact on the bank. kpmg llp, the independent auditors appointed by the shareholders of the bank, have audited the consolidated financial position of the bank as at october 31, 2024 and october 31, 2023 and its consolidated financial performance and its consolidated cash flows for each of the years in the two-year period ended october 31, 2024 prepared in accordance with ifrs as issued by the international accounting standards board (iasb) in accordance with canadian generally accepted auditing standards and the standards of the public company accounting oversight board (united states) and the effectiveness of internal control over financial reporting and have expressed their opinions upon completion of such audits in the reports to the shareholders. the shareholders’ auditors have full and free access to, and meet periodically with, the audit and conduct review committee to discuss their audits, including any findings as to the integrity of the bank’s accounting, financial reporting and related matters. scott thomson president and chief executive officer 136 | 2024 scotiabank annual report raj viswanathan group head and chief financial officer toronto, canada december 3, 2024"
151,151,reporting entity the bank of nova scotia,basis of preparation statement of compliance,notes_consolidated_finnacial_statement,"reporting entity the bank of nova scotia (the bank) is a chartered schedule i bank under the bank act (canada) (the bank act) and is regulated by the office of the superintendent of financial institutions (osfi). the bank is a global financial services provider offering a diverse range of products and services, including personal, commercial, corporate and investment banking. the head office of the bank is located at 1709 hollis street, halifax, nova scotia, canada and its executive offices are at 40 temperance street, toronto, canada. the common shares of the bank are listed on the toronto stock exchange (tsx) and the new york stock exchange. 2"
