start_page,end_page,start_word,end_word,tag,extracted_text
65,65,credit ratings credit ratings are one of the factors that impact the,t33 flow statement for basel iii credit risk-weighted assets ($ millions),group_finnacial_condition,"credit ratings credit ratings are one of the factors that impact the bank’s access to capital markets and the terms on which it can conduct derivatives, hedging transactions and borrow funds. the credit ratings and outlook that the rating agencies assign to the bank are based on their own views and methodologies. the bank continues to have strong credit ratings and its deposits and legacy senior debt are rated aa by fitch ratings, aa2 by moody’s, aa by morningstar dbrs and a+ by standard and poor’s (s&p). the bank’s bail-inable senior debt is rated aa- by fitch ratings, a2 by moody’s, aa (low) by morningstar dbrs, and a- by s&p. as of october 31, 2024, all such rating agencies have a stable outlook on the bank. credit ratings are not recommendations to purchase, sell or hold a security and are subject to revision or withdrawal at any time by the rating agency. risk-weighted assets regulatory capital requirements are based on osfi’s target minimum percentage of risk-weighted assets (rwa). rwa represent the bank’s exposure to credit, market and operational risks and are computed by applying a combination of the osfi approved bank’s internal risk models and osfi prescribed risk weights to on and off-balance sheet exposures. in addition, osfi has adopted the revised basel iii aggregate output floor, which ensures that the bank’s total rwa are not lower than 72.5% of rwa as calculated by the revised basel iii framework’s standardized approaches. the output floor has been set at 72.5% with an international phase-in period from 2023 to 2028. for canadian banks, the floor is presently at 67.5%. as noted above, osfi has delayed further increases to the floor to 2026 (70%) and 2027 (72.5%). as at year end, the bank’s rwa of $464.0 billion, represents an increase of approximately $24.0 billion, or 5.5%, from 2023, due primarily to the adoption impacts from the revised basel iii frtb market and cva capital requirements, higher rwa from changes in book quality, model updates, and the bank’s initial investment in keycorp, partly offset by lower volumes from capital optimization initiatives and the impacts from foreign currency translation. credit risk-weighted assets credit risk measures the risk that a borrower or counterparty will fail to honour its financial or contractual obligations to the bank. the credit risk component consists of on and off-balance sheet claims. the basel iii rules are not applied to traditional balance sheet categories but to categories of on and off-balance sheet exposures which represent general classes of assets or exposure types (e.g. large corporate, mid-size corporate, small and medium enterprise, sovereign, bank, retail mortgages, other retail, equity, etc.) based on their different underlying risk characteristics. generally, while calculating capital requirements, exposure types are analyzed by the following credit risk exposure sub-types: drawn, undrawn, repo-style transactions, over-the-counter (otc) derivatives, exchange-traded derivatives and other off-balance sheet claims. credit risk-weighted assets increased by $19.5 billion to $398.2 billion. the key drivers or components of the change are reflected in table t33 below."
66,67,credit risk-weighted assets – non-retail the bank uses the internal ratings based (irb) approach under revised basel iii,t36 portfolio-level comparison of estimated and actual non-retail percentages,group_finnacial_condition,"credit risk-weighted assets – non-retail the bank uses the internal ratings based (irb) approach under revised basel iii to determine minimum regulatory capital requirements for credit risk in its canadian, u.s. and european credit portfolios, and for a significant portion of its international corporate and commercial portfolios. the remaining credit portfolios are subject to the standardized approach, which relies on the external credit ratings (e.g. s&p, morningstar dbrs, fitch, etc.) of borrowers, if available, or prescribed risk weights for real estate lending to compute regulatory capital for credit risk. for the bank’s corporate, bank and sovereign irb portfolios, the key risk measures used in the quantification of regulatory capital for credit risk include probability of default (pd), loss given default (lgd) and exposure at default (ead). • probability of default (pd) measures the likelihood that a borrower, with an assigned internal grade (ig) rating, will default within a one-year time horizon. ig ratings are a component of the bank’s risk rating system. each of the bank’s internal borrower ig ratings is mapped to a pd estimate. 64 | 2024 scotiabank annual report
• loss given default (lgd) measures the severity of loss on a facility in the event of a borrower’s default. lgd segments are determined based on facility characteristics such as seniority, collateral type, collateral coverage and other structural elements. each lgd segment is assigned a lgd estimate. lgd is based on the concept of economic loss and is calculated using the present value of repayments, recoveries and related direct and indirect expenses. • exposure at default (ead) measures the expected exposure on a facility at the time of default. under the advanced internal ratings based (airb) approach, all three risk measures are estimated using the bank’s historical data, as well as available external benchmarks, and are updated on a regular basis. the historical data used for estimating these risk measures exceeds the minimum five-year airb requirement for pd estimates and the minimum seven-year airb requirement for lgd and ead estimates. under revised basel iii there are new irb requirements for internally developed model parameters under airb including scope restrictions which limit certain asset classes to only the foundation internal ratings based (firb) approach. for those asset classes (e.g. large corporates, banks, etc.) the firb utilizes the bank’s internally modeled pd parameters combined with internationally prescribed lgd and ead parameters. further adjustments, as required under the basel iii framework and osfi’s requirements set out in its domestic implementation notes, including any input floor requirements, are applied to average estimates obtained from historical data. these adjustments incorporate the regulatory requirements pertaining to: • long-run estimation of pd, which requires that pd estimates capture average default experience over a reasonable mix of high-default and low-default years of the economic cycle; • downturn estimation for internally modeled airb lgd, which requires that lgd estimates appropriately reflect conditions observed during periods where credit losses are substantially higher than average; • downturn estimation for internally modeled airb ead, which requires that ead estimates appropriately reflect conditions observed during periods of economic downturn; and • the addition of a margin of conservatism, which is related to the likely range of errors based on the identification and quantification of the various sources of uncertainty inherent in historical estimates. these risk measures are used in the calculation of regulatory capital requirements based on the basel framework. the credit quality distribution of the bank’s irb non-retail portfolio is shown in table t35. portfolio average pd, lgd and rw increased marginally year-over-year due to changes in customer ratings and model updates. the risk measures are subject to a rigorous back-testing framework which uses the bank’s historical data to ensure that they are appropriately calibrated. based on results obtained from the back-testing process, risk measures are reviewed, re-calibrated and independently validated on at least an annual basis in order to reflect the implications of new data, technical advances and other relevant information. • as pd estimates represent long-run parameters, back-testing is performed using historical data spanning at least one full economic cycle. realized pds are back-tested using pre-defined confidence intervals, and the results are then aggregated to provide an overall assessment of the appropriateness of each pd estimate; • the back-testing for airb lgd and ead estimates is conducted from both long-run and downturn perspectives, in order to ensure that these estimates are adequately conservative to reflect both long-run and downturn conditions. portfolio-level back-testing results, based on a comparison of estimated and realized parameters for the four-quarter period ended at july 31, 2024, are shown in table t36. during this period the actual experiences of pd, lgd and ccf were materially lower than the estimates as reflected within the risk parameters."
67,68,credit risk-weighted assets – canadian retail the airb approach is used to determine minimum regulatory,t37 retail airb portfolio exposure by pd range,group_finnacial_condition,"credit risk-weighted assets – canadian retail the airb approach is used to determine minimum regulatory capital requirements for the retail credit portfolio in canada. the retail portfolio is comprised of the following revised basel-based pools: • residential real estate secured exposures mainly consist of conventional and high ratio residential mortgages and all other products opened under the scotia total equity plan (step), such as mortgage loans, credit cards and secured lines of credit; • qualifying revolving retail exposures (qrre) consist of unsecured credit cards and lines of credit, including transactors and revolvers; • other retail consists of term loans (secured and unsecured), as well as credit cards and lines of credit which are secured by assets other than real estate or do not meet the qrre definition. for the airb portfolios, the following models and parameters are estimated, subject to parameter input floors as required by osfi: • probability of default (pd) is the likelihood that the facility will default within the next 12 months. • loss given default (lgd) measures the estimated economic loss as a proportion of the defaulted balance. • exposure at default (ead) is the portion of expected exposures at time of default. the data observation period used for pd/ead/lgd estimates meets the five year minimum. various statistical techniques including predictive modeling and decision trees were used to develop models. the models assign accounts into homogenous segments using internal and external borrower/facility-level credit experience. every month, exposures are automatically re-rated based on risk and loss characteristics. pd, lgd and ead estimates are then assigned to each of these segments incorporating the following regulatory requirements: • pd incorporates the average long run default experience over an economic cycle. this long run average includes a mix of high and low default years. management’s discussion and analysis | group financial condition 2024 scotiabank annual report | 65
management’s discussion and analysis • lgd is adjusted to appropriately reflect economic downturn conditions. • ead may also be adjusted to reflect downturn conditions when pd and ead are highly correlated. • sources of uncertainty are reviewed regularly to ensure uncertainties are identified, quantified and included in calculations so that all parameter estimates reflect appropriate levels of conservatism. the table below summarizes the credit quality distribution of the bank’s airb retail portfolio as at october 31, 2024. year-over-year the bank’s airb retail portfolio parameters and average risk weights at the total portfolio level remained stable."
68,68,all airb models and parameters are monitored on a quarterly basis and independently,t38 estimated and actual loss parameters,group_finnacial_condition,"all airb models and parameters are monitored on a quarterly basis and independently validated annually by the global risk management group. these models are tested to ensure rank ordering and back testing of parameters is appropriate. comparison of estimated and actual loss parameters for the period ended july 31, 2024 is shown in table t38. during this period the actual experience was generally more favourable to the estimates as reflected by the risk parameters; however, for residential real estate secured exposures, actual pds are slightly elevated as they reflect the most recent year of defaults while estimated pds reflect the long run overall portfolio averages."
68,69,credit risk-weighted assets – international retail international retail credit portfolios follow the standardized approach and consist of the following components:,t39 total market risk capital,group_finnacial_condition,"credit risk-weighted assets – international retail international retail credit portfolios follow the standardized approach and consist of the following components: • residential real estate secured lending; and, • other regulatory retail, mainly consisting of term loans and credit card and lines of credit transactors and revolvers. under the standardized approach, each of the above components is risk-weighted based on prescribed risk weights, which consider borrower or facility attributes, such as, loan-to-value, transactors vs. revolvers, and drawn vs. undrawn. market risk market risk is the risk of loss from changes in market prices including interest rates, credit spreads, equity prices, foreign exchange rates, and commodity prices, the correlations between them, and their levels of volatility. 66 | 2024 scotiabank annual report
market risk – market risk-weighted assets following the implementation of the revised osfi capital adequacy requirements in q1 2024, var, stressed var (svar) and the incremental risk charge (irc) are no longer components of market risk capital. the bank now calculates market risk capital based on the standardized approach under the new fundamental review of the trading book (frtb) framework. prior periods have not been restated to conform to the new frtb requirements. below are the market risk requirements as at october 31, 2024 and 2023:"
69,70,"market risk-weighted assets increased by $2.7 billion to $14.7 billion, as shown in the table above","off-balance sheet arrangements in the normal course of business, the bank enters into contractual",group_finnacial_condition,"market risk-weighted assets increased by $2.7 billion to $14.7 billion, as shown in the table above . this was primarily due to higher market risk- weighted assets under the new market risk capital rules, offset by changes in risk levels. market risk – cva risk-weighted assets credit valuation adjustment (cva) is the adjustment to the risk free mark-to-market value of transactions to account for the potential default of a counterparty. cva risk is the risk of loss arising from changing cva values in response to changes in counterparty credit spreads and market risk factors. following the implementation of the revised osfi capital adequacy requirements (car) in q1 2024, the bank applies primarily the standardized approach (sa-cva) for calculating cva capital as approved by osfi, and for netting sets carved out from sa-cva, the basic approach (ba-cva). cva capital covers derivatives; sft positions which are not fair valued for accounting purposes are excluded from cva capital. operational risk operational risk is the risk of loss, whether direct or indirect, to which the bank is exposed due to external events, human error, or the inadequacy or failure of processes, procedures, systems or controls. consistent with osfi’s adoption of the revised basel iii reforms, the bank applies the standardized approach (sa) for calculating operational risk capital requirements. under the sa, operational risk capital is determined based on the existing gross income approach further supplemented by a scalar or internal loss multiplier (ilm) that recognizes the bank’s operational risk loss experience. operational risk-weighted assets increased by $1.8 billion during the year to $51.1 billion, due primarily to growth in the bank’s gross income and an increase to the bank’s ilm. internal capital the bank utilizes economic capital methodologies and measures to calculate internal capital. internal capital is a measure of the unexpected losses inherent in the bank’s business activities. the calculation of internal capital relies on models that are subject to independent vetting and validation as required by the bank’s model risk management policy. management assesses its risk profile to determine those risks for which the bank should attribute internal capital. the major risk categories included in internal capital are: • credit risk covers derivatives, repo-style transactions, securitizations, corporate and commercial loans and retail products. the measurement of inte rnal capital mainly leverages the bank’s internal credit risk ratings and a monte-carlo simulation model calibrated based on the bank’s actual experience in probabilities of default, exposures at default, expected severity of loss in the event of default, concentration and diversification. management’s discussion and analysis | group financial condition 2024 scotiabank annual report | 67
management’s discussion and analysis • market risk for internal capital incorporates the higher of: a market risk var calibrated to a higher 99.95% confidence interval, and regulatory capital components under the new standardized approaches. for the banking book, structural interest rate and foreign exchange risks leverage a modelled approach based on economic value of equity (eve) sensitivities. • operational risk for internal capital is calculated based on an approach consistent with the bank’s regulatory capital requirements including a conservative forward-looking view of gross income. • other risks include additional risks for which internal capital is attributed, such as business risk, significant investments, insurance risk and real estate risk. in addition, the bank’s measure of internal capital includes a diversification benefit which recognizes that all of the above risks will not occur simultaneously. the bank also includes the full amount of goodwill and intangible assets in the internal capital amount. for further discussion on risk management and details on credit, market and operational risks, refer to the risk management section."
70,71,"off-balance sheet arrangements in the normal course of business, the bank enters into contractual",t41 assets held by bank-sponsored canadian-based multi-seller conduits,group_finnacial_condition,"off-balance sheet arrangements in the normal course of business, the bank enters into contractual arrangements that are either consolidated or not required to be consolidated in its financial statements but could have a current or future impact on the bank’s financial performance or financial condition. these arrangements can be classified into the following categories: structured entities, securitizations, guarantees and other commitments. structured entities structured entities are designed to accomplish certain well-defined objectives and for which voting or similar rights are not the dominant factor in deciding who controls the entity. the bank may become involved with structured entities either at the formation stage or at a later date. the bank controls an investee when it is exposed, or has rights, to variable returns from its involvement with the investee and has the ability to affect those returns through its power over the investee. the bank’s arrangements with structured entities include: • structured entities that are used to provide a wide range of services to customers, such as structured entities established to allow clients to securitize their financial assets while facilitating cost-efficient financing, and to provide certain investment opportunities. • structured entities that the bank sponsors and actively manages. the bank consolidates all structured entities that it controls which includes a u.s. based multi-seller conduit and certain funding and other vehicles. for many of the structured entities that are used to provide services to customers, the bank does not guarantee the performance of the structured entities’ underlying assets and does not absorb any related losses. for other structured entities, such as securitization and investment vehicles, the bank may be exposed to credit, market, liquidity, or operational risks. noteholders of securitizations may also be exposed to these risks. the bank may earn fees based on the nature of its association with a structured entity. unconsolidated structured entities there are two primary types of association the bank has with unconsolidated structured entities: • canadian multi-seller conduits administered by the bank; and • structured finance entities. the bank earned total fees of $73 million in 2024 (october 31, 2023 – $51 million) from certain structured entities in which it had a significant interest at the end of the year but did not consolidate. more information with respect to the bank’s involvement with these unconsolidated structured entities, including details of liquidity facilities and maximum loss exposure by category is provided below and in note 16(b) to the consolidated financial statements. canadian multi-seller conduits administered by the bank the bank sponsors two canadian-based multi-seller conduits that are not consolidated. the bank earned commercial paper issuance fees, program management fees, liquidity fees and other fees from these multi-seller conduits, which totaled $54 million in 2024, compared to $47 million in 2023. these multi-seller conduits purchase high-quality financial assets and finance these assets through the issuance of highly-rated commercial paper. as further described below, the bank’s exposure to these off-balance sheet conduits primarily consists of liquidity support and temporary holdings of commercial paper. although the bank has power over the relevant activities of the conduits, it has limited exposure to variability in returns, which results in the bank not consolidating the two canadian conduits. the bank has a process to monitor these exposures and significant events impacting the conduits to ensure there is no change in control, which could require the bank to consolidate the assets and liabilities of the conduits at fair value. a significant portion of the conduits’ assets have been structured to receive credit enhancements from the sellers, including overcollateralization protection and cash reserve accounts. each asset purchased by the conduits is supported by a backstop liquidity facility provided by the bank in the form of a liquidity asset purchase agreement (lapa). the primary purpose of the backstop liquidity facility is to provide an alternative source of financing in the event the conduits are unable to access the commercial paper market. under the terms of the lapa, in most cases, the bank is not obliged to purchase defaulted assets. the bank’s primary exposure to the canadian-based conduits is the liquidity support provided, with total liquidity facilities of $7.7 billion as at october 31, 2024 (october 31, 2023 – $7.1 billion). the year-over-year increase was due to normal business operations. as at october 31, 2024, total commercial paper outstanding for the canadian-based conduits was $6.4 billion (october 31, 2023 – $5.4 billion) and the bank held 0.1% (october 31, 2023 – 0.2%) of the total commercial paper issued by these conduits. table t41 presents a summary of assets purchased and held by the bank’s two canadian multi-seller conduits as at october 31, 2024 and 2023, by underlying exposure. all of the funded assets have at least an equivalent rating of aa or higher based on the bank’s internal rating program; and assets held in these conduits were investment grade as at october 31, 2024 and 2023. 68 | 2024 scotiabank annual report"
